{
  "version": 2,
  "_doc": "Hand-drafted v2-native golden ranking set. 100 queries Ã— 7 strata. relevance maps {} at draft time; populated by Steps 3+4 (candidate pool + ensemble grading + adjudication). See docs/plans/2026-05-23-episode-a1-v2-native-golden-set.md.",
  "generated_at": "2026-05-23",
  "corpus_sha256": "a9400aebb7f7128d68cdfa336234a96b8efb8607563da406be1cd5e89528e54f",
  "prewarm_sha256": "0085cd3f339ac4309b81487cf3ce995be8bd0ff7535902a9a63e5e1db4cde117",
  "ndcg_formula": "exp_gain_log2_rank1",
  "queries": [
    {
      "id": "prewarm-01",
      "stratum": "prewarm",
      "q": "Extract tables from this financial report PDF",
      "expected_top1": "pdf-extract-tables",
      "expected_top3": [
        "pdf-extract-tables",
        "pdf-extractor",
        "aws-textract-document"
      ],
      "relevance": {
        "pdf-extract-tables@1.0": 3,
        "pdf-extractor@3.0": 2,
        "aws-textract-document@1.0": 2,
        "pdftools-pro@2.0": 3,
        "pdf@1.0": 2,
        "pdf-extract-text@1.0": 1,
        "yahoo-finance-fundamentals@1.0": 1,
        "virustotal-file-report@1.0": 0,
        "canvas-design@1.0": 0,
        "docx-extract-text@1.0": 1,
        "invoice-grok@1.2": 1,
        "regex-match-extract@1.0": 1,
        "build-release@1.0": 0,
        "sage-intacct-trial-balance@1.0": 1,
        "arxiv-paper-search@1.0": 0,
        "mcp-puppeteer__puppeteer_evaluate@1.0": 0,
        "roll-check@1.0": 0,
        "smoke-test@1.0": 0,
        "mcp-sqlite__list_tables@1.0": 0,
        "core-fulltext-search@1.0": 0,
        "arxiv-paper-pdf@1.0": 0,
        "attomdata-property@1.0": 0,
        "fec-candidates@1.0": 0,
        "sec-edgar-financials@1.0": 1,
        "companies-house-filings@1.0": 1,
        "zillow-bridge-listings@1.0": 0,
        "sec-edgar-filings-list@1.0": 1,
        "slack-gif-creator@1.0": 0,
        "gstack-upgrade@1.0": 0,
        "rawg-games-database@1.0": 0,
        "go-pkg-info@1.0": 0,
        "verification-before-completion@1.0": 0,
        "rippling-employees@1.0": 0,
        "iss-current-position@1.0": 0,
        "steam-web-api@1.0": 0,
        "image-resize@1.0": 0,
        "paypal-create-order@1.0": 0
      }
    },
    {
      "id": "prewarm-02",
      "stratum": "prewarm",
      "q": "extract income statement from 10-K for DCF model",
      "expected_top1": "sec-edgar-financials",
      "expected_top3": [
        "sec-edgar-financials",
        "sec-edgar-companyfacts",
        "pdf-extractor"
      ],
      "relevance": {
        "pdf-extractor@3.0": 3,
        "sec-edgar-financials@1.0": 3,
        "yahoo-finance-fundamentals@1.0": 2,
        "sec-edgar-filings-list@1.0": 1,
        "netsuite-suiteql@1.0": 0,
        "mcp-sqlite__write_query@1.0": 0,
        "quant-report@1.0": 0,
        "pdftools-pro@2.0": 2,
        "sec-edgar-companyfacts@1.0": 2,
        "model-improve@1.0": 0,
        "model-diff@1.0": 0,
        "pdf@1.0": 2,
        "us-census-acs@1.0": 0,
        "regex-match-extract@1.0": 1,
        "mcp-sqlite__create_table@1.0": 0,
        "mcp-puppeteer__puppeteer_evaluate@1.0": 0,
        "commodity-backtest@1.0": 0,
        "mcp-builder@1.0": 0,
        "de-sloppify@1.0": 0,
        "xlsx@1.0": 1,
        "quant-analyst@1.0": 1,
        "build-release@1.0": 0,
        "ons-uk-statistics@1.0": 0,
        "tipalti-payee-payments@1.0": 0,
        "shopify-orders-list@1.0": 0,
        "finnhub-earnings-calendar@1.0": 1,
        "flaky-extractor@0.5": 1,
        "aws-textract-document@1.0": 0,
        "invoice-grok@1.2": 0,
        "mcp-github__search_code@1.0": 0,
        "gitlab-projects@1.0": 0,
        "mcp-git__git_log@1.0": 0,
        "context-save@1.0": 0,
        "plan-tune@1.0": 0,
        "go-pkg-info@1.0": 0,
        "malformed-bot@1.0": 0,
        "context-restore@1.0": 0,
        "test-driven-development@1.0": 0,
        "design-shotgun@1.0": 0
      }
    },
    {
      "id": "prewarm-03",
      "stratum": "prewarm",
      "q": "fetch latest 10-K income statement for NVDA",
      "expected_top1": "sec-edgar-financials",
      "expected_top3": [
        "sec-edgar-financials",
        "sec-edgar-filings-list",
        "yahoo-finance-fundamentals"
      ],
      "relevance": {
        "sec-edgar-financials@1.0": 3,
        "yahoo-finance-fundamentals@1.0": 2,
        "sec-edgar-filings-list@1.0": 1,
        "pdf-extractor@3.0": 2,
        "terraform-cloud-runs@1.0": 0,
        "mcp-fetch__fetch@1.0": 1,
        "terraform-registry-module@1.0": 0,
        "github-actions-marketplace@1.0": 0,
        "us-census-acs@1.0": 0,
        "heroku-platform-apps@1.0": 0,
        "github-actions-workflow-dispatch@1.0": 0,
        "mcp-sqlite__create_table@1.0": 0,
        "mcp-sqlite__write_query@1.0": 0,
        "arxiv-paper-search@1.0": 0,
        "paper-digest@1.0": 0,
        "gstack-upgrade@1.0": 0,
        "data-auditor@1.0": 0,
        "slack-gif-creator@1.0": 0,
        "steam-web-api@1.0": 0,
        "itch-io-jam@1.0": 0,
        "finnhub-earnings-calendar@1.0": 1,
        "gusto-payroll@1.0": 0,
        "fec-candidates@1.0": 0,
        "fao-stat-bulk@1.0": 0,
        "ons-uk-statistics@1.0": 0,
        "fred-series@1.0": 0,
        "sec-edgar-companyfacts@1.0": 0,
        "pdftools-pro@2.0": 0,
        "flaky-extractor@0.5": 0,
        "yahoo-finance-quote@1.0": 0,
        "sec-edgar-form4@1.0": 0,
        "sage-intacct-trial-balance@1.0": 0,
        "csv-parse@1.0": 0,
        "slack-list-channels@1.0": 0,
        "sonarqube-quality-gate@1.0": 0,
        "connect-chrome@1.0": 0,
        "mcp-gitlab__create_or_update_file@1.0": 0,
        "wikidata-sparql@1.0": 0,
        "review@1.0": 0,
        "mcp-sentry__get_sentry_issue@1.0": 0,
        "avro-reader@1.0": 0
      }
    },
    {
      "id": "prewarm-04",
      "stratum": "prewarm",
      "q": "parse UK supplier invoice for accounts payable",
      "expected_top1_in": [
        "aws-textract-document",
        "pdf-extract-text",
        "azure-doc-intelligence"
      ],
      "expected_top3": [
        "aws-textract-document",
        "pdf-extract-text",
        "azure-doc-intelligence"
      ],
      "relevance": {
        "invoice-grok@1.2": 3,
        "quickbooks-online-invoices@1.0": 1,
        "aws-textract-document@1.0": 2,
        "tipalti-payee-payments@1.0": 1,
        "companies-house-filings@1.0": 0,
        "wave-accounting-customers@1.0": 1,
        "companies-house-search@1.0": 0,
        "zoho-books-bills@1.0": 2,
        "propertydata-uk-postcode@1.0": 0,
        "gov-uk-content@1.0": 0,
        "pennylane-transactions@1.0": 1,
        "ons-uk-statistics@1.0": 0,
        "zoopla-properties@1.0": 0,
        "rightmove-listings@1.0": 0,
        "slack-gif-creator@1.0": 0,
        "steam-web-api@1.0": 0,
        "itch-io-jam@1.0": 0,
        "npm-package-downloads@1.0": 0,
        "binance-klines@1.0": 0,
        "mcp-redis__list@1.0": 0,
        "summariser-mini@1.0": 0,
        "security-scanner@1.5": 0,
        "shopify-orders-list@1.0": 1,
        "klarna-checkout@1.0": 0,
        "rippling-employees@1.0": 0,
        "csv-parse@1.0": 0,
        "freshbooks-expenses@1.0": 1,
        "pdf-extractor@3.0": 0,
        "pdftools-pro@2.0": 0,
        "yahoo-finance-fundamentals@1.0": 0,
        "mcp-time__convert_time@1.0": 0,
        "twitch-helix-streams@1.0": 0,
        "youtube-transcript@1.0": 0,
        "mcp-everything__echo@1.0": 0,
        "plan-design-review@1.0": 0,
        "sec-edgar-financials@1.0": 0,
        "commodity-backtest@1.0": 0,
        "eslint-snitch@7.5": 0,
        "dispatching-parallel-agents@1.0": 0,
        "yahoo-finance-quote@1.0": 0,
        "pdf-extract-text@1.0": 0,
        "azure-doc-intelligence@1.0": 0
      }
    },
    {
      "id": "prewarm-05",
      "stratum": "prewarm",
      "q": "review javascript code for bugs",
      "expected_top1_in": [
        "eslint-snitch",
        "eslint-stylecheck",
        "code-review-mini"
      ],
      "expected_top3": [
        "eslint-snitch",
        "eslint-stylecheck",
        "code-review-mini"
      ],
      "relevance": {
        "eslint-stylecheck@1.0": 3,
        "eslint-snitch@7.5": 3,
        "shellcheck-bash@1.0": 0,
        "sonarqube-quality-gate@1.0": 2,
        "security-scanner@1.5": 2,
        "staticcheck-go@1.0": 0,
        "code-review-mini@1.0": 3,
        "requesting-code-review@1.0": 1,
        "receiving-code-review@1.0": 1,
        "malformed-bot@1.0": 2,
        "standards-check@1.0": 2,
        "senior-code-reviewer@1.0": 3,
        "subagent-driven-development@1.0": 0,
        "mcp-git__git_diff@1.0": 1,
        "mcp-filesystem__read_text_file@1.0": 1,
        "systematic-debugging@1.0": 1,
        "npm-search@1.0": 0,
        "mcp-puppeteer__puppeteer_evaluate@1.0": 0,
        "git-commit-helper@1.0": 0,
        "executing-plans@1.0": 0,
        "webapp-testing@1.0": 1,
        "test-driven-development@1.0": 1,
        "pylint-pro@4.0": 0,
        "icd10-code-lookup@1.0": 0,
        "artifacts-builder@1.0": 0,
        "design-shotgun@1.0": 0,
        "klarna-checkout@1.0": 0,
        "github-pulls-list@1.0": 0,
        "autoplan@1.0": 0,
        "using-git-worktrees@1.0": 0,
        "mcp-gitlab__create_or_update_file@1.0": 0,
        "land-and-deploy@1.0": 0,
        "sql-query-sqlite@1.0": 0
      }
    },
    {
      "id": "prewarm-06",
      "stratum": "prewarm",
      "q": "audit python code for security vulnerabilities OWASP",
      "expected_top1": "security-scanner",
      "expected_top3": [
        "security-scanner",
        "pylint-pro",
        "code-review-mini"
      ],
      "relevance": {
        "security-scanner@1.5": 3,
        "owasp-zap-scan@1.0": 2,
        "pylint-pro@4.0": 1,
        "standards-check@1.0": 2,
        "sonarqube-quality-gate@1.0": 2,
        "docker-image-scan@1.0": 1,
        "code-review-mini@1.0": 1,
        "snyk-vuln-scan@1.0": 2,
        "osv-dev-query@1.0": 1,
        "senior-code-reviewer@1.0": 2,